{
  "$schema": "https://json-schema.org/draft/2020-12/schema",
  "$id": "https://schemas.globalgovernanceframeworks.org/wdip/1.7/wise-decision-making-integration-protocol-v1.7.schema.json",
  "title": "WDIP v1.7 Record Envelope",
  "type": "object",
  "required": [
    "record_id",
    "record_type",
    "schema_version",
    "created_at",
    "effective_at",
    "expires_at",
    "status",
    "normative_force",
    "authority_effect",
    "action_class",
    "source_framework_id",
    "source_framework_version",
    "source_record_ids",
    "supersedes",
    "superseded_by",
    "actor_id",
    "actor_type",
    "office_or_role",
    "representation_source",
    "technical_credential_refs",
    "constituting_instrument",
    "legal_power",
    "jurisdiction_territorial",
    "jurisdiction_personal",
    "jurisdiction_subject_matter",
    "jurisdiction_temporal",
    "affected_party_refs",
    "affected_indigenous_nation_refs",
    "protected_domain_flags",
    "consent_record_refs",
    "authority_record_refs",
    "activation_record_refs",
    "access_class",
    "public_summary",
    "protected_annex_refs",
    "data_purpose",
    "retention_rule",
    "correction_status",
    "challenge_status",
    "review_due_at",
    "closure_state",
    "unresolved_duty_refs",
    "handoff_state",
    "recipient_refs",
    "recipient_acceptance_refs",
    "hashes_and_signatures",
    "human_accountable_officer",
    "prohibited_inferences",
    "consequence_profile",
    "authority_formation",
    "response_duty_effect",
    "response_duty_source",
    "acknowledgment_clock_source",
    "decision_clock_source",
    "response_time_assessment_ref",
    "provisional_safe_state_record_ref",
    "post_acceptance_action_clock_ref",
    "epistemic_roles",
    "uncertainty_summary",
    "dissent_refs",
    "protected_knowledge_rules",
    "recommendation_decision_relation",
    "wdip_payload"
  ],
  "properties": {
    "record_id": {
      "type": [
        "string",
        "null"
      ]
    },
    "record_type": {
      "enum": [
        "WDIP-01",
        "WDIP-02",
        "WDIP-03",
        "WDIP-04",
        "WDIP-05",
        "WDIP-06",
        "WDIP-07",
        "WDIP-08",
        "WDIP-09",
        "WDIP-10",
        "WDIP-11",
        "WDIP-12",
        "WDIP-13",
        "WDIP-14",
        "WDIP-15",
        "WDIP-16",
        "WDIP-17",
        "WDIP-18",
        "WDIP-19",
        "WDIP-20",
        "WDIP-21",
        "WDIP-22",
        "WDIP-23",
        "WDIP-24",
        "WDIP-25",
        "WDIP-26",
        "WDIP-27",
        "WDIP-28",
        "WDIP-29",
        "WDIP-30",
        "WDIP-31",
        "WDIP-32",
        "WDIP-33",
        "WDIP-34",
        "WDIP-35",
        "WDIP-36",
        "WDIP-37",
        "WDIP-38",
        "WDIP-39",
        "WDIP-40",
        "WDIP-41",
        "WDIP-42",
        "WDIP-43",
        "WDIP-44",
        "WDIP-45",
        "WDIP-46",
        "WDIP-47",
        "WDIP-48",
        "WDIP-49",
        "WDIP-50",
        "WDIP-51",
        "WDIP-52",
        "WDIP-53",
        "WDIP-54",
        "WDIP-55",
        "WDIP-56",
        "WDIP-57",
        "WDIP-58",
        "WDIP-59",
        "WDIP-60"
      ]
    },
    "schema_version": {
      "const": "WDIP/1.7"
    },
    "created_at": {
      "type": [
        "string",
        "null"
      ]
    },
    "effective_at": {
      "type": [
        "string",
        "null"
      ]
    },
    "expires_at": {
      "type": [
        "string",
        "null"
      ]
    },
    "status": {
      "type": [
        "string",
        "null"
      ]
    },
    "normative_force": {
      "type": [
        "string",
        "null"
      ]
    },
    "authority_effect": {
      "enum": [
        "none",
        "advisory",
        "procedural_support",
        "evidentiary",
        "consent_evidence",
        "authority_reference",
        "authorizing",
        "activating",
        "executing",
        "closing"
      ]
    },
    "action_class": {
      "enum": [
        "A",
        "B",
        "C",
        "D",
        "E",
        "F",
        "G",
        "H",
        "I",
        "J",
        "K",
        "L",
        "M",
        "N",
        "O",
        "P"
      ]
    },
    "source_framework_id": {
      "const": "WDIP"
    },
    "source_framework_version": {
      "const": "1.7"
    },
    "source_record_ids": {
      "type": "array",
      "items": {
        "type": "string"
      }
    },
    "supersedes": {
      "type": "array",
      "items": {
        "type": "string"
      }
    },
    "superseded_by": {
      "type": "array",
      "items": {
        "type": "string"
      }
    },
    "actor_id": {
      "type": [
        "string",
        "null"
      ]
    },
    "actor_type": {
      "type": [
        "string",
        "null"
      ]
    },
    "office_or_role": {
      "type": [
        "string",
        "null"
      ]
    },
    "representation_source": {
      "type": [
        "string",
        "null"
      ]
    },
    "technical_credential_refs": {
      "type": "array",
      "items": {
        "type": "string"
      }
    },
    "constituting_instrument": {
      "type": [
        "string",
        "null"
      ]
    },
    "legal_power": {
      "type": [
        "string",
        "null"
      ]
    },
    "jurisdiction_territorial": {
      "type": [
        "string",
        "null"
      ]
    },
    "jurisdiction_personal": {
      "type": [
        "string",
        "null"
      ]
    },
    "jurisdiction_subject_matter": {
      "type": [
        "string",
        "null"
      ]
    },
    "jurisdiction_temporal": {
      "type": [
        "string",
        "null"
      ]
    },
    "affected_party_refs": {
      "type": "array",
      "items": {
        "type": "string"
      }
    },
    "affected_indigenous_nation_refs": {
      "type": "array",
      "items": {
        "type": "string"
      }
    },
    "protected_domain_flags": {
      "type": "array",
      "items": {
        "type": "string"
      }
    },
    "consent_record_refs": {
      "type": "array",
      "items": {
        "type": "string"
      }
    },
    "authority_record_refs": {
      "type": "array",
      "items": {
        "type": "string"
      }
    },
    "activation_record_refs": {
      "type": "array",
      "items": {
        "type": "string"
      }
    },
    "access_class": {
      "type": [
        "string",
        "null"
      ]
    },
    "public_summary": {
      "type": [
        "string",
        "null"
      ]
    },
    "protected_annex_refs": {
      "type": "array",
      "items": {
        "type": "string"
      }
    },
    "data_purpose": {
      "type": [
        "string",
        "null"
      ]
    },
    "retention_rule": {
      "type": [
        "string",
        "null"
      ]
    },
    "correction_status": {
      "type": [
        "string",
        "null"
      ]
    },
    "challenge_status": {
      "type": [
        "string",
        "null"
      ]
    },
    "review_due_at": {
      "type": [
        "string",
        "null"
      ]
    },
    "closure_state": {
      "type": [
        "string",
        "null"
      ]
    },
    "unresolved_duty_refs": {
      "type": "array",
      "items": {
        "type": "string"
      }
    },
    "handoff_state": {
      "type": [
        "string",
        "null"
      ],
      "enum": [
        "offered",
        "acknowledged",
        "accepted",
        "partially_accepted",
        "capacity_limited",
        "refused",
        "deferred",
        "referred",
        "timed_out",
        "misrouted",
        "constitutional_gap",
        "returned",
        "closed",
        null
      ]
    },
    "recipient_refs": {
      "type": "array",
      "items": {
        "type": "string"
      }
    },
    "recipient_acceptance_refs": {
      "type": "array",
      "items": {
        "type": "string"
      }
    },
    "hashes_and_signatures": {
      "type": "object"
    },
    "human_accountable_officer": {
      "type": [
        "string",
        "null"
      ]
    },
    "prohibited_inferences": {
      "type": [
        "string",
        "null"
      ]
    },
    "consequence_profile": {
      "enum": [
        "CP0",
        "CP1",
        "CP2",
        "CP3"
      ]
    },
    "authority_formation": {
      "type": [
        "string",
        "null"
      ],
      "enum": [
        "retained",
        "delegated",
        "transferred",
        "concurrent",
        "jointly_constituted",
        "absent",
        null
      ]
    },
    "response_duty_effect": {
      "type": [
        "string",
        "null"
      ],
      "enum": [
        "legal",
        "contractual",
        "charter_internal",
        "voluntary_commitment",
        "advisory",
        "none",
        null
      ]
    },
    "response_duty_source": {
      "type": [
        "string",
        "null"
      ]
    },
    "acknowledgment_clock_source": {
      "type": [
        "string",
        "null"
      ]
    },
    "decision_clock_source": {
      "type": [
        "string",
        "null"
      ]
    },
    "response_time_assessment_ref": {
      "type": [
        "string",
        "null"
      ]
    },
    "provisional_safe_state_record_ref": {
      "type": [
        "string",
        "null"
      ]
    },
    "post_acceptance_action_clock_ref": {
      "type": [
        "string",
        "null"
      ]
    },
    "epistemic_roles": {
      "type": "array",
      "items": {
        "enum": [
          "empirical",
          "legal",
          "testimonial",
          "indigenous_or_traditional",
          "ethical_or_philosophical",
          "spiritual_or_ceremonial",
          "model_or_scenario",
          "intuitive_or_creative",
          "mixed_with_explicit_boundaries"
        ]
      }
    },
    "uncertainty_summary": {
      "type": [
        "string",
        "null"
      ]
    },
    "dissent_refs": {
      "type": "array",
      "items": {
        "type": "string"
      }
    },
    "protected_knowledge_rules": {
      "type": "object"
    },
    "recommendation_decision_relation": {
      "type": [
        "string",
        "null"
      ]
    },
    "wdip_payload": {
      "type": "object"
    }
  },
  "additionalProperties": false
}
