{
  "record_id": "WDIP-EXAMPLE-001",
  "record_type": "WDIP-27",
  "schema_version": "WDIP/1.7",
  "created_at": "2026-08-06T00:00:00+02:00",
  "effective_at": "2026-08-06T00:00:00+02:00",
  "expires_at": null,
  "status": "published_nonoperative",
  "normative_force": "advisory",
  "authority_effect": "none",
  "action_class": "E",
  "source_framework_id": "WDIP",
  "source_framework_version": "1.7",
  "source_record_ids": [],
  "supersedes": [],
  "superseded_by": [],
  "actor_id": "example-actor",
  "actor_type": "human_body_or_institution",
  "office_or_role": "example facilitator",
  "representation_source": null,
  "technical_credential_refs": [],
  "constituting_instrument": null,
  "legal_power": null,
  "jurisdiction_territorial": null,
  "jurisdiction_personal": null,
  "jurisdiction_subject_matter": null,
  "jurisdiction_temporal": null,
  "affected_party_refs": [],
  "affected_indigenous_nation_refs": [],
  "protected_domain_flags": [],
  "consent_record_refs": [],
  "authority_record_refs": [],
  "activation_record_refs": [],
  "access_class": "public_summary_with_protected_annex",
  "public_summary": "An exploratory assumption audit compares causal and moral premises without making a decision.",
  "protected_annex_refs": [],
  "data_purpose": "validation example",
  "retention_rule": "delete or archive under the process plan",
  "correction_status": "open",
  "challenge_status": "open",
  "review_due_at": null,
  "closure_state": "open",
  "unresolved_duty_refs": [],
  "handoff_state": null,
  "recipient_refs": [],
  "recipient_acceptance_refs": [],
  "hashes_and_signatures": {
    "sha256": "example-not-a-release-hash"
  },
  "human_accountable_officer": "example-officer",
  "prohibited_inferences": "Example data creates no authority or real-world finding.",
  "consequence_profile": "CP0",
  "authority_formation": null,
  "response_duty_effect": null,
  "response_duty_source": null,
  "acknowledgment_clock_source": null,
  "decision_clock_source": null,
  "response_time_assessment_ref": null,
  "provisional_safe_state_record_ref": null,
  "post_acceptance_action_clock_ref": null,
  "epistemic_roles": [
    "empirical",
    "ethical_or_philosophical"
  ],
  "uncertainty_summary": "Illustrative only.",
  "dissent_refs": [],
  "protected_knowledge_rules": {},
  "recommendation_decision_relation": null,
  "wdip_payload": {
    "assumptions": [
      {
        "type": "causal",
        "statement": "Service fragmentation causes delay",
        "status": "hypothesis"
      },
      {
        "type": "ethical",
        "statement": "Equal access should outrank administrative convenience",
        "status": "normative premise"
      }
    ],
    "non_activation": true
  }
}
