{
  "record_id": "WDIP-EXAMPLE-003",
  "record_type": "WDIP-22",
  "schema_version": "WDIP/1.7",
  "created_at": "2026-08-06T00:00:00+02:00",
  "effective_at": "2026-08-06T00:00:00+02:00",
  "expires_at": null,
  "status": "accepted_with_restrictions",
  "normative_force": "advisory",
  "authority_effect": "procedural_support",
  "action_class": "D",
  "source_framework_id": "WDIP",
  "source_framework_version": "1.7",
  "source_record_ids": [],
  "supersedes": [],
  "superseded_by": [],
  "actor_id": "nation-appointed-knowledge-holder",
  "actor_type": "indigenous_knowledge_holder",
  "office_or_role": "example facilitator",
  "representation_source": "affected nation appointment record",
  "technical_credential_refs": [],
  "constituting_instrument": null,
  "legal_power": null,
  "jurisdiction_territorial": null,
  "jurisdiction_personal": null,
  "jurisdiction_subject_matter": null,
  "jurisdiction_temporal": null,
  "affected_party_refs": [],
  "affected_indigenous_nation_refs": [
    "nation-record-01"
  ],
  "protected_domain_flags": [],
  "consent_record_refs": [],
  "authority_record_refs": [],
  "activation_record_refs": [],
  "access_class": "public_summary_with_protected_annex",
  "public_summary": "A nation-controlled traditional-knowledge contribution is restricted to oral use in one deliberation.",
  "protected_annex_refs": [
    "protected-annex-oral-only-01"
  ],
  "data_purpose": "validation example",
  "retention_rule": "delete or archive under the process plan",
  "correction_status": "open",
  "challenge_status": "open",
  "review_due_at": null,
  "closure_state": "open",
  "unresolved_duty_refs": [],
  "handoff_state": null,
  "recipient_refs": [],
  "recipient_acceptance_refs": [],
  "hashes_and_signatures": {
    "sha256": "example-not-a-release-hash"
  },
  "human_accountable_officer": "example-officer",
  "prohibited_inferences": "Example data creates no authority or real-world finding.",
  "consequence_profile": "CP1",
  "authority_formation": null,
  "response_duty_effect": null,
  "response_duty_source": null,
  "acknowledgment_clock_source": null,
  "decision_clock_source": null,
  "response_time_assessment_ref": null,
  "provisional_safe_state_record_ref": null,
  "post_acceptance_action_clock_ref": null,
  "epistemic_roles": [
    "indigenous_or_traditional"
  ],
  "uncertainty_summary": "The contribution is authoritative for its permitted cultural role; it is not a universal empirical claim.",
  "dissent_refs": [],
  "protected_knowledge_rules": {
    "public_quote": false,
    "digitization": false,
    "ai_training": false,
    "translation": "nation approval required",
    "withdrawal": "available at any time before closure",
    "destruction": "delete facilitator notes after approved oral summary"
  },
  "recommendation_decision_relation": "contribution informs deliberation but does not constitute consent or decision",
  "wdip_payload": {
    "permitted_use": "single local deliberation",
    "oral_only": true,
    "generic_authentication_prohibited": true
  }
}
