{
  "record_id": "WDIP-EXAMPLE-002",
  "record_type": "WDIP-40",
  "schema_version": "WDIP/1.7",
  "created_at": "2026-08-06T00:00:00+02:00",
  "effective_at": "2026-08-06T00:00:00+02:00",
  "expires_at": null,
  "status": "capacity_limited",
  "normative_force": "advisory",
  "authority_effect": "authority_reference",
  "action_class": "I",
  "source_framework_id": "WDIP",
  "source_framework_version": "1.7",
  "source_record_ids": [],
  "supersedes": [],
  "superseded_by": [],
  "actor_id": "example-actor",
  "actor_type": "human_body_or_institution",
  "office_or_role": "example facilitator",
  "representation_source": null,
  "technical_credential_refs": [],
  "constituting_instrument": null,
  "legal_power": null,
  "jurisdiction_territorial": null,
  "jurisdiction_personal": null,
  "jurisdiction_subject_matter": null,
  "jurisdiction_temporal": null,
  "affected_party_refs": [],
  "affected_indigenous_nation_refs": [],
  "protected_domain_flags": [],
  "consent_record_refs": [],
  "authority_record_refs": [
    "GMEAIA-20-example-01"
  ],
  "activation_record_refs": [],
  "access_class": "public_summary_with_protected_annex",
  "public_summary": "The authority accepts responsibility for a decision but lacks current translation and procurement capacity.",
  "protected_annex_refs": [],
  "data_purpose": "validation example",
  "retention_rule": "delete or archive under the process plan",
  "correction_status": "open",
  "challenge_status": "open",
  "review_due_at": null,
  "closure_state": "open",
  "unresolved_duty_refs": [],
  "handoff_state": "capacity_limited",
  "recipient_refs": [
    "municipal-executive-board"
  ],
  "recipient_acceptance_refs": [
    "ack-example-2026-08-06"
  ],
  "hashes_and_signatures": {
    "sha256": "example-not-a-release-hash"
  },
  "human_accountable_officer": "example-officer",
  "prohibited_inferences": "Example data creates no authority or real-world finding.",
  "consequence_profile": "CP2",
  "authority_formation": "retained",
  "response_duty_effect": "charter_internal",
  "response_duty_source": "municipal deliberation charter §8",
  "acknowledgment_clock_source": "municipal deliberation charter §8",
  "decision_clock_source": "GMEAIA-07-example-17",
  "response_time_assessment_ref": "GMEAIA-07-example-17",
  "provisional_safe_state_record_ref": null,
  "post_acceptance_action_clock_ref": "municipal-action-clock-03",
  "epistemic_roles": [
    "legal",
    "empirical"
  ],
  "uncertainty_summary": "Illustrative only.",
  "dissent_refs": [],
  "protected_knowledge_rules": {},
  "recommendation_decision_relation": "recommendation acknowledged; implementation not authorized or active",
  "wdip_payload": {
    "recognized_jurisdiction": true,
    "capacity_gaps": [
      "translation staff",
      "accessible procurement"
    ],
    "requested_support": [
      "temporary shared translation service"
    ],
    "constitutional_gap": false,
    "automatic_transfer": false
  }
}
